{
  "schema_version": "3.2-b.1",
  "run_id": "run-nomem-0001",
  "task_id": "task-dog-0001",
  "task": {
    "prompt": "What did the user say about their dog?"
  },
  "candidate_discovery": null,
  "candidate_set": null,
  "reranking": null,
  "selection": null,
  "selected_evidence": null,
  "reasoning_context": null,
  "reasoning_output": null,
  "final_response": null,
  "created_at": "2026-08-01T00:00:00Z"
}
